{
  "format": "osd.custody/2",
  "record_id": "terranubis/f3-demo-2020",
  "path": "F3_Demo_2023_seismic.zip",
  "origin_href": null,
  "key": "mirror/terranubis/f3-demo-2020/98cae06f479eb8c9e9084e5e6dcee0ef935005d3c977c514780dade75ed377fb/F3_Demo_2023_seismic.zip",
  "href": "https://mirror.example/mirror/terranubis/f3-demo-2020/98cae06f479eb8c9e9084e5e6dcee0ef935005d3c977c514780dade75ed377fb/F3_Demo_2023_seismic.zip",
  "sha256": "98cae06f479eb8c9e9084e5e6dcee0ef935005d3c977c514780dade75ed377fb",
  "bytes": 920,
  "copied_at": "2026-10-29T10:01:00Z",
  "deposit": {
    "obtained_at": "2026-10-29T10:00:00Z",
    "by": "maintainer",
    "publisher_page_url": "https://terranubis.com/datainfo/F3-Demo-2023",
    "publisher_page_sha256": "7e5e22f8bfdfb3391335ddfc2a274d2fbdcd84c955100ab90a0f3d4ef8a6088c",
    "licence_text_sha256": "8fb31f3a7aea41edc02ac3553f663237e66a1a56916389d1dd9c88e373c757d0"
  },
  "licence": {
    "name": "Creative Commons 3.0 (the page links the BY-SA 3.0 deed)",
    "spdx": "CC-BY-SA-3.0",
    "url": "https://creativecommons.org/licenses/by-sa/3.0/",
    "redistribution": "allowed",
    "attribution": "required",
    "share_alike": true
  },
  "licence_text_sha256": "8fb31f3a7aea41edc02ac3553f663237e66a1a56916389d1dd9c88e373c757d0",
  "attribution": [
    "## F3 Demo 2020 (Dutch North Sea)",
    "",
    "- Record: terranubis/f3-demo-2020 (collection terranubis--f3-demo-2020)",
    "- Origin: https://terranubis.com/datainfo/F3-Demo-2020",
    "- Licence: Creative Commons 3.0 (the page links the BY-SA 3.0 deed) (CC-BY-SA-3.0), https://creativecommons.org/licenses/by-sa/3.0/",
    "- Attribution: required",
    "- Redistribution: allowed",
    "- Share-alike: derived work must carry CC-BY-SA-3.0",
    "- Statement: none stated by the publisher in the record",
    "- Known issue: Publisher replaced F3-Demo-2020 with F3 Demo 2023 on 12 June 2023; /datainfo/F3-Demo-2020 now serves the 2023 page (7.6 GB, 4.5 GB download), whose licence label links the BY-SA 3.0 deed. Licence fields corrected from the earlier BY-SA 4.0 entry to what the page states."
  ],
  "takedown": "https://github.com/ophiolite-labs/open-subsurface-data/issues/new?template=takedown.yml",
  "removal": {
    "state": "held"
  }
}
